Authors;Author(s) ID;Title;Year;Source title;Volume;Issue;Art. No.;Page start;Page end;Page count;Cited by;DOI;Link;Document Type;Publication Stage;Open Access;Source;EID
"Vázquez-Ingelmo; A.; García-Pẽalvo; F.J.; Therón; R.";"57195074625;16031087300;6602575901;";Tailored information dashboards: A systematic mapping of the literature;2019;PervasiveHealth: Pervasive Computing Technologies for Healthcare;;;26;;;;;10.1145/3335595.3335628;https://www.scopus.com/inward/record.uri?eid=2-s2.0-85068832314&doi=10.1145%2f3335595.3335628&partnerID=40&md5=2e3041ceefbb6118c8d64c595565abef;Conference Paper;Final;;Scopus;2-s2.0-85068832314
"Giakoumis; D.; Segkouli; S.; Votis; K.; Paliokas; I.; Altsitsiadis; E.; Tzovaras; D.";"35147896000;56347914200;12788889700;6506588780;37100996600;13105681700;";"Smart; personalized and adaptive ICT solutions for active; healthy and productive ageing with enhanced workability";2019;PervasiveHealth: Pervasive Computing Technologies for Healthcare;;;;442;447;;4;10.1145/3316782.3322767;https://www.scopus.com/inward/record.uri?eid=2-s2.0-85069208290&doi=10.1145%2f3316782.3322767&partnerID=40&md5=b3583fb9b2fcb522526c6a16b0fee905;Conference Paper;Final;"All Open Access; Green";Scopus;2-s2.0-85069208290
"Santos Lavrador; A.M.; Laureano; R.M.S.";"57210264612;37017381200;";Dashboard to monitor performance of an hotel in the financial perspective;2019;"Iberian Conference on Information Systems and Technologies; CISTI";2019-June;;8760853;;;;4;10.23919/CISTI.2019.8760853;https://www.scopus.com/inward/record.uri?eid=2-s2.0-85070105654&doi=10.23919%2fCISTI.2019.8760853&partnerID=40&md5=505ecfdff879b90d6d4aae9f6a22a450;Conference Paper;Final;;Scopus;2-s2.0-85070105654
"Gardner; L.A.; Bray; P.J.; Finley; E.; Sterner; C.; Ignudo; T.L.; Stauffer; C.L.; Kincaid; S.A.; Marella; W.M.";"55917070200;57209050800;23027321400;57209052418;57209051026;57209053123;57209045054;8683447800;";Standardizing Falls Reporting: Using Data from Adverse Event Reporting to Drive Quality Improvement;2019;Journal of Patient Safety;15;2;;135;142;;1;10.1097/PTS.0000000000000204;https://www.scopus.com/inward/record.uri?eid=2-s2.0-85066408946&doi=10.1097%2fPTS.0000000000000204&partnerID=40&md5=a92771a94881fb3a9f893c79cbf4244c;Article;Final;;Scopus;2-s2.0-85066408946
"Holzmeister; F.; Kerschbamer; R.";"57189379270;6602333937;";oTree: The Equality Equivalence Test;2019;Journal of Behavioral and Experimental Finance;22;;;214;222;;1;10.1016/j.jbef.2019.04.001;https://www.scopus.com/inward/record.uri?eid=2-s2.0-85064318267&doi=10.1016%2fj.jbef.2019.04.001&partnerID=40&md5=7358f7db31d450730d3ac8bf2169e2c1;Article;Final;"All Open Access; Green";Scopus;2-s2.0-85064318267
"Iott; B.; Caverly; T.; Fishstrom; A.; King; D.; Meng; G.; Flynn; A.";"57015542900;55185264200;55585977100;57209465098;57194131415;8637795600;";"Clinician perspectives on the user experience; configuration; and scope of use of a patient reported outcomes (PRO) dashboard";2019;PervasiveHealth: Pervasive Computing Technologies for Healthcare;;;;21;30;;;10.1145/3329189.3329198;https://www.scopus.com/inward/record.uri?eid=2-s2.0-85067891925&doi=10.1145%2f3329189.3329198&partnerID=40&md5=f6834c86ed7ea13170689e382f44a5df;Conference Paper;Final;;Scopus;2-s2.0-85067891925
"Jiang; D.; Huang; R.; Calyam; P.; Gillis; J.; Apperson; O.; Chemodanov; D.; Demir; F.; Ahmad; S.";"57209107058;57216533700;6507285722;56785412400;57189233233;55800558900;57209099907;56784897400;";Hierarchical cloud-fog platform for communication in disaster incident coordination;2019;"Proceedings - 2019 7th IEEE International Conference on Mobile Cloud Computing; Services; and Engineering; MobileCloud 2019";;;8710664;1;7;;1;10.1109/MobileCloud.2019.00008;https://www.scopus.com/inward/record.uri?eid=2-s2.0-85066480767&doi=10.1109%2fMobileCloud.2019.00008&partnerID=40&md5=32826d4ea0c453d628347488d0c80e00;Conference Paper;Final;;Scopus;2-s2.0-85066480767
"Sopan; A.; Berninger; M.; Mulakaluri; M.; Katakam; R.";"36349016800;57209055446;57209050840;57209052595;";"Building a Machine Learning Model for the SOC; by the Input from the SOC; and Analyzing it for the SOC";2019;"2018 IEEE Symposium on Visualization for Cyber Security; VizSec 2018";;;8709231;;;;2;10.1109/VIZSEC.2018.8709231;https://www.scopus.com/inward/record.uri?eid=2-s2.0-85066397906&doi=10.1109%2fVIZSEC.2018.8709231&partnerID=40&md5=07ea86a642b0af12b88e8646a58d7b6c;Conference Paper;Final;;Scopus;2-s2.0-85066397906
"Patel; M.S.; Rathi; B.; Tashfeen; K.; Yarubi; M.A.";"57195240672;55092946300;55625713500;57209802454;";Development and implementation of maternity dashboard in regional hospital for quality improvement at ground level: A pilot study;2019;Oman Medical Journal;34;3;;194;199;;2;10.5001/omj.2019.38;https://www.scopus.com/inward/record.uri?eid=2-s2.0-85068754751&doi=10.5001%2fomj.2019.38&partnerID=40&md5=a556f625948501192fdf2e166aae2067;Article;Final;"All Open Access; Gold; Green";Scopus;2-s2.0-85068754751
"Saini; R.; Marriboyina; V.; Sood; S.";"57220500850;57209251058;56208202900;";A novel dashboard framework to enhance patient outcome in health informatics;2019;International Journal of Innovative Technology and Exploring Engineering;8;7;;1515;1519;;;;https://www.scopus.com/inward/record.uri?eid=2-s2.0-85067837647&partnerID=40&md5=0cabe794dc779c91172b6850a1edf562;Article;Final;;Scopus;2-s2.0-85067837647
"Damyanov; I.; Tsankov; N.";"57188678120;26027356200;";On the possibilities of applying dashboards in the educational system;2019;TEM Journal;8;2;;424;429;;2;10.18421/TEM82-15;https://www.scopus.com/inward/record.uri?eid=2-s2.0-85067568941&doi=10.18421%2fTEM82-15&partnerID=40&md5=c043ed36fcbeeab684d1b1f2022cf1dc;Article;Final;;Scopus;2-s2.0-85067568941
"Vitacca; M.; Vitacca; M.";"7006584059;57209205519;";Proposal of a multidimensional strategic-management dashboard for use in a rehabilitation respiratory unit;2019;Medicine;98;20;;e15728;;;2;10.1097/MD.0000000000015728;https://www.scopus.com/inward/record.uri?eid=2-s2.0-85066874175&doi=10.1097%2fMD.0000000000015728&partnerID=40&md5=9ddf9ada0a4cce684466213f4483cbae;Article;Final;"All Open Access; Gold; Green";Scopus;2-s2.0-85066874175
"Seder; C.W.; Magee; M.J.; Broderick; S.R.; Brown; L.M.; Blasberg; J.D.; Kozower; B.D.; Fernandez; F.G.; Welsh; R.J.; Gaissert; H.A.; Burfeind; W.R.; Becker; S.; Raymond; D.P.";"26024502100;7005485381;6701729716;56323044500;35087959800;6603343155;7401589045;7201893145;55965588200;6603113829;57193339159;7103274579;";The Society of Thoracic Surgeons General Thoracic Surgery Database 2019 Update on Outcomes and Quality;2019;Annals of Thoracic Surgery;107;5;;1302;1306;;9;10.1016/j.athoracsur.2019.02.027;https://www.scopus.com/inward/record.uri?eid=2-s2.0-85064389695&doi=10.1016%2fj.athoracsur.2019.02.027&partnerID=40&md5=bb45e601c5e4b19350deb1666e1ad459;Article;Final;"All Open Access; Bronze";Scopus;2-s2.0-85064389695
"Arvanitou; E.-M.; Ampatzoglou; A.; Bibi; S.; Chatzigeorgiou; A.; Stamelos; I.";"55209903200;16027681600;14719125500;6701702023;6604041235;";Monitoring technical debt in an industrial setting;2019;PervasiveHealth: Pervasive Computing Technologies for Healthcare;;;;123;132;;2;10.1145/3319008.3319019;https://www.scopus.com/inward/record.uri?eid=2-s2.0-85064748153&doi=10.1145%2f3319008.3319019&partnerID=40&md5=c99ed920df31b9d987f159666a3f0655;Conference Paper;Final;"All Open Access; Green";Scopus;2-s2.0-85064748153
"Okanovi; D.; Van Hoorn; A.; Zorn; C.; Beck; F.; Ferme; V.; Walter; J.";"57203417917;26421837600;25650925700;25824730200;55319324200;56939872200;";Concern-driven Reporting of Software Performance Analysis Results;2019;ICPE 2019 - Companion of the 2019 ACM/SPEC International Conference on Performance Engineering;;;;1;4;;6;10.1145/3302541.3313103;https://www.scopus.com/inward/record.uri?eid=2-s2.0-85064700404&doi=10.1145%2f3302541.3313103&partnerID=40&md5=00a6c4de06c6ac82bfc3fa175b668966;Conference Paper;Final;;Scopus;2-s2.0-85064700404
"Ohligs; M.; Pereira; C.; Voigt; V.; Koeny; M.; Janß; A.; Rossaint; R.; Czaplik; M.";"57205311108;55811884300;57188925738;36198312800;23473116800;55416543900;34970858000;";Evaluation of an anesthesia dashboard functional model based on a manufacturer-independent communication standard: Comparative feasibility study;2019;JMIR Human Factors;6;2;e12553;;;;;10.2196/12553;https://www.scopus.com/inward/record.uri?eid=2-s2.0-85106544600&doi=10.2196%2f12553&partnerID=40&md5=47452105eb9924eeb376e567e556cd16;Article;Final;"All Open Access; Gold; Green";Scopus;2-s2.0-85106544600
"El-Hasan; T.S.";"6602100365;";Internet of Thing (IoT) based remote labs in engineering;2019;"2019 6th International Conference on Control; Decision and Information Technologies; CoDIT 2019";;;8820591;976;982;;4;10.1109/CoDIT.2019.8820591;https://www.scopus.com/inward/record.uri?eid=2-s2.0-85072836711&doi=10.1109%2fCoDIT.2019.8820591&partnerID=40&md5=477999d69d710666efdc2c669ef55d63;Conference Paper;Final;;Scopus;2-s2.0-85072836711
"Setiawan; H.; Sumitro; A.A.A.; Gustriansyah; R.";"57208752755;57209477835;57189347061;";The change data capture and the web application messaging protocol on the real time dashboard;2019;International Journal of Engineering and Advanced Technology;8;4;;223;227;;;;https://www.scopus.com/inward/record.uri?eid=2-s2.0-85067880797&partnerID=40&md5=82efb98af9de22bc297a7eb272af74fa;Article;Final;;Scopus;2-s2.0-85067880797
"Gourevitch; M.N.; Athens; J.K.; Levine; S.E.; Kleiman; N.; Thorpe; L.E.";"7007104000;24463593600;57207769971;35942934700;7005574413;";"City-level measures of health; health determinants; and equity to foster population health improvement: The City health dashboard";2019;American Journal of Public Health;109;4;;585;592;;18;10.2105/AJPH.2018.304903;https://www.scopus.com/inward/record.uri?eid=2-s2.0-85062883031&doi=10.2105%2fAJPH.2018.304903&partnerID=40&md5=d4eebc300e5749a60d1a6016e905ac69;Article;Final;"All Open Access; Green";Scopus;2-s2.0-85062883031
"Schultheis; H.; Kuenne; C.; Preussner; J.; Wiegandt; R.; Fust; A.; Bentsen; M.; Looso; M.";"57207830916;56816785100;55598270900;57207828101;57194454472;57207832755;35503631400;";WIlsON: Web-based Interactive Omics VisualizatioN;2019;Bioinformatics;35;6;;1055;1057;;9;10.1093/bioinformatics/bty711;https://www.scopus.com/inward/record.uri?eid=2-s2.0-85062940018&doi=10.1093%2fbioinformatics%2fbty711&partnerID=40&md5=a3bf4502fe65822ea5226f2f20349e57;Article;Final;"All Open Access; Hybrid Gold; Green";Scopus;2-s2.0-85062940018
"Sanaei; S.; Majidi; B.; Akhtarkavan; E.";"57208124523;15845948800;36522152100;";Deep Multisensor Dashboard for Composition Layer of Web of Things in the Smart City;2019;"9th International Symposium on Telecommunication: With Emphasis on Information and Communication Technology; IST 2018";;;8661092;211;215;;11;10.1109/ISTEL.2018.8661092;https://www.scopus.com/inward/record.uri?eid=2-s2.0-85063859582&doi=10.1109%2fISTEL.2018.8661092&partnerID=40&md5=c6607c9bd8271d82202ea2c759d2dcd4;Conference Paper;Final;;Scopus;2-s2.0-85063859582
"Narendranath; A.D.";"55828060700;";Raspberry Pi based learning center usage tracking system for optimal resource allocation;2019;"Proceedings - Frontiers in Education Conference; FIE";2018-October;;8659225;;;;;10.1109/FIE.2018.8659225;https://www.scopus.com/inward/record.uri?eid=2-s2.0-85063490769&doi=10.1109%2fFIE.2018.8659225&partnerID=40&md5=c6c235d518fdac31f8f5f50541063bea;Conference Paper;Final;;Scopus;2-s2.0-85063490769
"Azcona; D.; Hsiao; I.-H.; Smeaton; A.F.";"57193264092;22834963700;7003631244;";Personalizing computer science education by leveraging multimodal learning analytics;2019;"Proceedings - Frontiers in Education Conference; FIE";2018-October;;8658596;;;;1;10.1109/FIE.2018.8658596;https://www.scopus.com/inward/record.uri?eid=2-s2.0-85063442297&doi=10.1109%2fFIE.2018.8658596&partnerID=40&md5=9aff9aae2ef692d444b3f1ea6b2b2810;Conference Paper;Final;;Scopus;2-s2.0-85063442297
"Molenaar; I.; Horvers; A.; Baker; R.S.";"24577798700;57207728321;8967971100;";Towards hybrid human-system regulation: Understanding children' SRL support needs in blended classrooms;2019;PervasiveHealth: Pervasive Computing Technologies for Healthcare;;;;471;480;;9;10.1145/3303772.3303780;https://www.scopus.com/inward/record.uri?eid=2-s2.0-85062794167&doi=10.1145%2f3303772.3303780&partnerID=40&md5=693142e5eb5facbfbdfb5901aad16352;Conference Paper;Final;;Scopus;2-s2.0-85062794167
"Lekshmi; S.; Raj; D.; Ponnekanti; S.";"57216346006;56428709600;6604052644;";Connectivity platform to deliver sync as a service for 5G digital enterprise;2019;"2019 International Conference on Wireless Communications; Signal Processing and Networking; WiSPNET 2019";;;9032866;530;533;;;10.1109/WiSPNET45539.2019.9032866;https://www.scopus.com/inward/record.uri?eid=2-s2.0-85083256818&doi=10.1109%2fWiSPNET45539.2019.9032866&partnerID=40&md5=30dea81b6ecf665168691a32e2366cc6;Conference Paper;Final;;Scopus;2-s2.0-85083256818
"Dillenberger; D.N.; Novotny; P.; Zhang; Q.; Jayachandran; P.; Gupta; H.; Hans; S.; Verma; D.; Chakraborty; S.; Thomas; J.J.; Walli; M.M.; Vaculin; R.; Sarpatwar; K.";"6507030752;57201980610;56102954300;22834876900;57196845474;35078595000;57214983108;35721531100;56150656300;57210188061;24400079800;55342452100;";Blockchain analytics and artificial intelligence;2019;IBM Journal of Research and Development;63;2;8645631;;;;28;10.1147/JRD.2019.2900638;https://www.scopus.com/inward/record.uri?eid=2-s2.0-85069815188&doi=10.1147%2fJRD.2019.2900638&partnerID=40&md5=aee10b5b4c5b957bbb0258af3db24264;Article;Final;;Scopus;2-s2.0-85069815188
"Cully; B.; Jaco; J.";"57207313960;57207313706;";Make Data-Driven Decisions Using Intelligent Dashboards and Smart Infrastructure;2019;Journal - American Water Works Association;111;3;;72;74;;;10.1002/awwa.1256;https://www.scopus.com/inward/record.uri?eid=2-s2.0-85062430319&doi=10.1002%2fawwa.1256&partnerID=40&md5=df1b5f695bf38824836bb8eaadfc4f32;Note;Final;;Scopus;2-s2.0-85062430319
"Lau; M.K.; Bounthavong; M.; Kay; C.L.; Harvey; M.A.; Christopher; M.L.D.";"57195550708;16315255400;57195550625;57193132248;36097749700;";Clinical dashboard development and use for academic detailing in the U.S. Department of Veterans Affairs;2019;Journal of the American Pharmacists Association;59;2;;S96;S103.e3;;11;10.1016/j.japh.2018.12.006;https://www.scopus.com/inward/record.uri?eid=2-s2.0-85060751124&doi=10.1016%2fj.japh.2018.12.006&partnerID=40&md5=0bfa217f23262d7697535a80aedc58e5;Article;Final;;Scopus;2-s2.0-85060751124
"Aljohani; N.R.; Daud; A.; Abbasi; R.A.; Alowibdi; J.S.; Basheri; M.; Aslam; M.A.";"54790711600;28267686800;27867465800;55530840700;55556420000;57209846696;";An integrated framework for course adapted student learning analytics dashboard;2019;Computers in Human Behavior;92;;;679;690;;17;10.1016/j.chb.2018.03.035;https://www.scopus.com/inward/record.uri?eid=2-s2.0-85055977462&doi=10.1016%2fj.chb.2018.03.035&partnerID=40&md5=9aa41b25ba90355d91807b7b0d7522e7;Article;Final;;Scopus;2-s2.0-85055977462
"Chua; G.G.; Min Chim Lim; P.; Mak; M.T.; Siong Ng; W.; Guo; S.; Chan; A.L.; Chua Zhen Liang; D.";"7004431632;56154845600;56154960900;7401613485;56154945700;57201294609;57203060196;";A Flexible Qualitative Data Analytics Dashboard;2019;"IEEE Region 10 Annual International Conference; Proceedings/TENCON";2018-October;;8650264;1865;1869;;1;10.1109/TENCON.2018.8650264;https://www.scopus.com/inward/record.uri?eid=2-s2.0-85063238269&doi=10.1109%2fTENCON.2018.8650264&partnerID=40&md5=5ba8266f237d9278ea914822b880c005;Conference Paper;Final;;Scopus;2-s2.0-85063238269
"Augustus Devarajan; A.; Sudalaimuthu; T.";"57211332483;36919367400;";Cloud storage monitoring system analyzing through file access pattern;2019;"ICCIDS 2019 - 2nd International Conference on Computational Intelligence in Data Science; Proceedings";;;8862113;;;;3;10.1109/ICCIDS.2019.8862113;https://www.scopus.com/inward/record.uri?eid=2-s2.0-85074151976&doi=10.1109%2fICCIDS.2019.8862113&partnerID=40&md5=0a4a5f858d03497f2313bb2b151125a2;Conference Paper;Final;;Scopus;2-s2.0-85074151976
"Lamest; M.; Brady; M.";"57200754929;23476643700;";Data-focused managerial challenges within the hotel sector;2019;Tourism Review;74;1;;104;115;;9;10.1108/TR-03-2017-0064;https://www.scopus.com/inward/record.uri?eid=2-s2.0-85047118927&doi=10.1108%2fTR-03-2017-0064&partnerID=40&md5=d8096e2ac6bc16e8de235dfb5fd02d5f;Article;Final;;Scopus;2-s2.0-85047118927
"Alexander; I.; Rassetiadi; R.; Garcia; S.; Girsang; A.S.; Isa; S.M.";"57200363632;57207735463;57207735720;55513277600;57216658927;";Business Solution for Choosing Products Using Data Warehouse in Payment Solution;2019;"1st 2018 Indonesian Association for Pattern Recognition International Conference; INAPR 2018 - Proceedings";;;8627028;141;146;;;10.1109/INAPR.2018.8627028;https://www.scopus.com/inward/record.uri?eid=2-s2.0-85062782390&doi=10.1109%2fINAPR.2018.8627028&partnerID=40&md5=2f2dc107808ff8c17c2e062c7f0b6ff8;Conference Paper;Final;;Scopus;2-s2.0-85062782390
"Alfredo; Y.F.; Girsang; A.S.; Isa; S.M.; Fajar; A.N.";"57205020554;55513277600;57216658927;57188877288;";Data Warehouse Development for Flight Reservation System;2019;"1st 2018 Indonesian Association for Pattern Recognition International Conference; INAPR 2018 - Proceedings";;;8627015;134;140;;;10.1109/INAPR.2018.8627015;https://www.scopus.com/inward/record.uri?eid=2-s2.0-85062775440&doi=10.1109%2fINAPR.2018.8627015&partnerID=40&md5=495c54b7e746b1d60743cdbfd3024573;Conference Paper;Final;;Scopus;2-s2.0-85062775440
"Teasley; S.D.";"6603844545;";Learning analytics: where information science and the learning sciences meet;2019;Information and Learning Science;120;1-feb;;59;73;;11;10.1108/ILS-06-2018-0045;https://www.scopus.com/inward/record.uri?eid=2-s2.0-85056758885&doi=10.1108%2fILS-06-2018-0045&partnerID=40&md5=84ee4bcc7c9639624025b2f2c7e74c24;Review;Final;;Scopus;2-s2.0-85056758885
"Monica; S.; Natalia; F.; Sudirman; S.";"57207454626;36782085000;24832522600;";Clustering Tourism Object in Bali Province Using K-Means and X-Means Clustering Algorithm;2019;"Proceedings - 20th International Conference on High Performance Computing and Communications; 16th International Conference on Smart City and 4th International Conference on Data Science and Systems; HPCC/SmartCity/DSS 2018";;;8622979;1462;1467;;4;10.1109/HPCC/SmartCity/DSS.2018.00241;https://www.scopus.com/inward/record.uri?eid=2-s2.0-85062564765&doi=10.1109%2fHPCC%2fSmartCity%2fDSS.2018.00241&partnerID=40&md5=db51b959174967efd3c26400d09470de;Conference Paper;Final;;Scopus;2-s2.0-85062564765
"Peters; R.; Oleari; E.; Sardu; F.; Neerincx; M.A.";"57191669042;55567854300;53981982700;9133405200;";Usability of the PAL objectives dashboard for children’s diabetes self-management education;2019;PervasiveHealth: Pervasive Computing Technologies for Healthcare;;;;22;28;;4;10.1145/3312714.3312736;https://www.scopus.com/inward/record.uri?eid=2-s2.0-85065757006&doi=10.1145%2f3312714.3312736&partnerID=40&md5=7c93844d3daff29c5fc8d62592968526;Conference Paper;Final;;Scopus;2-s2.0-85065757006
"Martinez-Millana; A.; Lizondo; A.; Gatta; R.; Vera; S.; Salcedo; V.T.; Fernandez-Llatas; C.";"49964119000;56989968100;14037272400;57205442702;36947073600;57204151458;";Process mining dashboard in operating rooms: Analysis of staff expectations with analytic hierarchy process;2019;International Journal of Environmental Research and Public Health;16;2;199;;;;12;10.3390/ijerph16020199;https://www.scopus.com/inward/record.uri?eid=2-s2.0-85060039925&doi=10.3390%2fijerph16020199&partnerID=40&md5=5a642f01774923a1eb68dafff86e002c;Article;Final;"All Open Access; Gold; Green";Scopus;2-s2.0-85060039925
"Wah; T.Y.; Suiying; T.; Shuangjie; A.L.";"57218270219;57218272023;57218271973;";Dashboards for decision making in higher education;2019;"ASCILITE 2019 - Conference Proceedings - 36th International Conference of Innovation; Practice and Research in the Use of Educational Technologies in Tertiary Education: Personalised Learning. Diverse Goals. One Heart.";;;;321;329;;;;https://www.scopus.com/inward/record.uri?eid=2-s2.0-85088515209&partnerID=40&md5=1eaf03525b6fcc18f31f5dee983868ab;Conference Paper;Final;;Scopus;2-s2.0-85088515209
"Alkinani; H.H.; Al-Hameedi; A.T.T.; Dunn-Norman; S.; Al-Alwani; M.A.; Mutar; R.A.; Al-Bazzaz; W.H.";"57200389487;57200390526;6602974782;57189522489;57209175678;8529750400;";State-of-the-art review of lost circulation materials and treatments - Part I: General trends and uses;2019;"Society of Petroleum Engineers - Abu Dhabi International Petroleum Exhibition and Conference 2019; ADIP 2019";;;;;;;5;10.2118/197393-ms;https://www.scopus.com/inward/record.uri?eid=2-s2.0-85088206256&doi=10.2118%2f197393-ms&partnerID=40&md5=a9115e6673fa0152f12c6076f1bd6693;Conference Paper;Final;;Scopus;2-s2.0-85088206256
"Susanti; F.; Hasanah; U.; Jaya; S.; Muttaqin; F.; Munir; B.";"57215133103;57217139743;57215116424;57215122987;57215138230;";AGir: One-stop application for asset integrity risk management;2019;"Society of Petroleum Engineers - SPE/IATMI Asia Pacific Oil and Gas Conference and Exhibition 2019; APOG 2019";;;;;;;;10.2118/196459-ms;https://www.scopus.com/inward/record.uri?eid=2-s2.0-85086057262&doi=10.2118%2f196459-ms&partnerID=40&md5=8c1dc3d6477c9b4f794a44428ac64b2d;Conference Paper;Final;;Scopus;2-s2.0-85086057262
"Tilley; I.; Petit; C.";"57216942004;57216942638;";A dashboard for the unexpected: Open data for real-time disaster response;2019;Open Cities | Open Data: Collaborative Cities in the Information Era;;;;265;286;;2;10.1007/978-981-13-6605-5_12;https://www.scopus.com/inward/record.uri?eid=2-s2.0-85085412303&doi=10.1007%2f978-981-13-6605-5_12&partnerID=40&md5=9ea794bf323c2381e9435dfec1b8d167;Book Chapter;Final;;Scopus;2-s2.0-85085412303
"Rashdan Mahmood; M.; Panwar; M.K.";"57203038620;57214911273;";Real time data analytics for process safety governance-case study;2019;"Society of Petroleum Engineers - Abu Dhabi International Petroleum Exhibition and Conference 2019; ADIP 2019";;;;;;;;;https://www.scopus.com/inward/record.uri?eid=2-s2.0-85084166611&partnerID=40&md5=3c6f5bf09068a9b877e622e0b9c98aeb;Conference Paper;Final;;Scopus;2-s2.0-85084166611
"Janssen; A.; Passlick; J.; Breitner; M.H.";"56797581700;57203985655;6602910157;";Using web analytics data: A participatory design model for individual web traffic report development;2019;"25th Americas Conference on Information Systems; AMCIS 2019";;;;;;;1;;https://www.scopus.com/inward/record.uri?eid=2-s2.0-85084022005&partnerID=40&md5=33bb90ae0c8ac5cd7e0249e0f3fac744;Conference Paper;Final;;Scopus;2-s2.0-85084022005
"Dossou; P.-E.";"36061182900;";Using industry 4.0 concepts and theory of systems for improving company supply chain: The example of a joinery;2019;Procedia Manufacturing;38;;;1750;1757;;3;10.1016/j.promfg.2020.01.093;https://www.scopus.com/inward/record.uri?eid=2-s2.0-85083530903&doi=10.1016%2fj.promfg.2020.01.093&partnerID=40&md5=579b0d28d0955d3b49ba1aee4685d629;Conference Paper;Final;"All Open Access; Gold";Scopus;2-s2.0-85083530903
"Blom; P.M.; Bakkes; S.; Spronck; P.";"56443691300;22333308100;57195385803;";Andromeda: A personalised crisis management training toolkit;2019;Lecture Notes in Computer Science (including subseries Lecture Notes in Artificial Intelligence and Lecture Notes in Bioinformatics);11899 LNCS;;;139;147;;;10.1007/978-3-030-34350-7_14;https://www.scopus.com/inward/record.uri?eid=2-s2.0-85082445736&doi=10.1007%2f978-3-030-34350-7_14&partnerID=40&md5=d9ea52dd1641177d16cb21b1914e3b11;Conference Paper;Final;"All Open Access; Green";Scopus;2-s2.0-85082445736
"Vaidyambath; R.; Debattista; J.; Srivatsa; N.; Brennan; R.";"57215655775;55802821600;57215656075;36447456700;";An intelligent linked data quality dashboard;2019;CEUR Workshop Proceedings;2563;;;341;352;;1;;https://www.scopus.com/inward/record.uri?eid=2-s2.0-85081557025&partnerID=40&md5=e39f6191a0e2c7565e63e880d4e14cbf;Conference Paper;Final;;Scopus;2-s2.0-85081557025
"Calvo-Morata; A.; Alonso-Fernández; C.; Pérez-Colado; I.J.; Freire; M.; Martínez-Ortiz; I.; Fernández-Manjón; B.";"56685605900;57194854581;57194854098;8551919600;8951372200;55884700700;";Improving teacher game learning analytics dashboards through ad-hoc development;2019;Journal of Universal Computer Science;25;12;;1507;1530;;2;;https://www.scopus.com/inward/record.uri?eid=2-s2.0-85079134164&partnerID=40&md5=04872c867c2c4311121628250e348b19;Article;Final;;Scopus;2-s2.0-85079134164
"Aksu; Ü.; del-Río-Ortega; A.; Resinas; M.; Reijers; H.A.";"57193055950;36704589800;15021461000;6603060277;";An approach for the automated generation of engaging dashboards;2019;Lecture Notes in Computer Science (including subseries Lecture Notes in Artificial Intelligence and Lecture Notes in Bioinformatics);11877 LNCS;;;363;384;;6;10.1007/978-3-030-33246-4_24;https://www.scopus.com/inward/record.uri?eid=2-s2.0-85077841096&doi=10.1007%2f978-3-030-33246-4_24&partnerID=40&md5=fc66eb069543d74c747efebd31858b99;Conference Paper;Final;;Scopus;2-s2.0-85077841096
"Nik Alwi; N.N.A.; Hassan; N.H.; Baharuden; A.F.; Bakar; N.A.A.; Maarop; N.";"57213604244;25621290400;57213605883;56330254700;45661569600;";Data visualization of supplier selection using business intelligence dashboard;2019;Lecture Notes in Computer Science (including subseries Lecture Notes in Artificial Intelligence and Lecture Notes in Bioinformatics);11870 LNCS;;;71;81;;;10.1007/978-3-030-34032-2_7;https://www.scopus.com/inward/record.uri?eid=2-s2.0-85077838669&doi=10.1007%2f978-3-030-34032-2_7&partnerID=40&md5=6f5edc137fca5f77ffd831e7c17b64b8;Conference Paper;Final;;Scopus;2-s2.0-85077838669
