Authors;Author(s) ID;Title;Year;Source title;Volume;Issue;Art. No.;Page start;Page end;Page count;Cited by;DOI;Link;Document Type;Publication Stage;Open Access;Source;EID
"del Molino; J.; Bibiloni; T.; Oliver; A.";"57199414849;22333408900;57205636573;";Keys for successful 360° hypervideo design: A user study based on an xAPI analytics dashboard;2020;Multimedia Tools and Applications;79;31-32;;22771;22796;;;10.1007/s11042-020-09059-2;https://www.scopus.com/inward/record.uri?eid=2-s2.0-85085747365&doi=10.1007%2fs11042-020-09059-2&partnerID=40&md5=f23bedd25484dbc2beb64d779a86accf;Article;Final;;Scopus;2-s2.0-85085747365
"Dieujuste; N.; Johnson-Koenke; R.; Christopher; M.; Gunzburger; E.C.; Emmendorfer; T.; Kessler; C.; Haukoos; J.; Smith; J.; Sasson; C.";"57200565944;57142579000;36097749700;57192176026;24484499000;56040578100;6603636854;57194350125;24924036600;";Feasibility Study of a Quasi-experimental Regional Opioid Safety Prescribing Program in Veterans Health Administration Emergency Departments;2020;Academic Emergency Medicine;27;8;;734;741;;1;10.1111/acem.13980;https://www.scopus.com/inward/record.uri?eid=2-s2.0-85084461849&doi=10.1111%2facem.13980&partnerID=40&md5=6fd201c458b1b1bacd0439a109b69816;Article;Final;"All Open Access; Bronze";Scopus;2-s2.0-85084461849
"Liu; L.H.; Garrett; S.B.; Li; J.; Ragouzeos; D.; Berrean; B.; Dohan; D.; Katz; P.P.; Barton; J.L.; Yazdany; J.; Schmajuk; G.";"57193800421;56800103300;57202721884;56611919800;56491246000;7004349261;7201652502;26530702700;7801494634;18438388000;";Patient and clinician perspectives on a patient-facing dashboard that visualizes patient reported outcomes in rheumatoid arthritis;2020;Health Expectations;23;4;;846;859;;2;10.1111/hex.13057;https://www.scopus.com/inward/record.uri?eid=2-s2.0-85083050936&doi=10.1111%2fhex.13057&partnerID=40&md5=74e3ebaca17a783adab35e29e248811b;Article;Final;"All Open Access; Gold; Green";Scopus;2-s2.0-85083050936
"Bencke; L.; Cechinel; C.; Munoz; R.";"57216252036;35097285700;57192589742;";Automated classification of social network messages into Smart Cities dimensions;2020;Future Generation Computer Systems;109;;;218;237;;10;10.1016/j.future.2020.03.057;https://www.scopus.com/inward/record.uri?eid=2-s2.0-85082946462&doi=10.1016%2fj.future.2020.03.057&partnerID=40&md5=383d0df57610dc0ba0c2de599bde59cb;Article;Final;;Scopus;2-s2.0-85082946462
"Cooper; J.; Olsher; S.; Yerushalmy; M.";"57191585672;57194147402;6507474267;";Didactic metadata informing teachers’ selection of learning resources: boundary crossing in professional development;2020;Journal of Mathematics Teacher Education;23;4;;363;384;;7;10.1007/s10857-019-09428-1;https://www.scopus.com/inward/record.uri?eid=2-s2.0-85061911613&doi=10.1007%2fs10857-019-09428-1&partnerID=40&md5=7db0ba0076094fac801e04b9dc3fc057;Article;Final;;Scopus;2-s2.0-85061911613
"Herder; E.; Van Maaren; O.";"14041509400;57218478916;";Privacy Dashboards: The Impact of the Type of Personal Data and User Control on Trust and Perceived Risk;2020;"UMAP 2020 Adjunct - Adjunct Publication of the 28th ACM Conference on User Modeling; Adaptation and Personalization";;;;169;174;;2;10.1145/3386392.3399557;https://www.scopus.com/inward/record.uri?eid=2-s2.0-85089282643&doi=10.1145%2f3386392.3399557&partnerID=40&md5=934017b9c9877578903c85b9610dce1c;Conference Paper;Final;"All Open Access; Green";Scopus;2-s2.0-85089282643
"Alhamadi; M.";"57218500300;";"Challenges; Strategies and Adaptations on Interactive Dashboards";2020;"UMAP 2020 - Proceedings of the 28th ACM Conference on User Modeling; Adaptation and Personalization";;;;368;371;;2;10.1145/3340631.3398678;https://www.scopus.com/inward/record.uri?eid=2-s2.0-85089343787&doi=10.1145%2f3340631.3398678&partnerID=40&md5=7252dfc94ec7dcd8d2c3d32d5e737892;Conference Paper;Final;"All Open Access; Green";Scopus;2-s2.0-85089343787
"Vitale; F.; Chen; J.; Odom; W.; Mcgrenere; J.";"57201448836;57218864312;6701770018;6505966811;";Data dashboard: Exploring centralization and customization in personal data curation;2020;DIS 2020 - Proceedings of the 2020 ACM Designing Interactive Systems Conference;;;;311;326;;3;10.1145/3357236.3395457;https://www.scopus.com/inward/record.uri?eid=2-s2.0-85090501833&doi=10.1145%2f3357236.3395457&partnerID=40&md5=2a2febb83dca817cd6a9a5a0f3c74f5f;Conference Paper;Final;;Scopus;2-s2.0-85090501833
"Mackey; T.K.; Li; J.; Purushothaman; V.; Nali; M.; Shah; N.; Bardier; C.; Cai; M.; Liang; B.";"30067646600;57209587966;57219703630;57220921834;57209584462;57220922991;57216747554;36658720400;";"Big data; natural language processing; and deep learning to detect and characterize illicit COVID-19 product sales: Infoveillance study on Twitter and Instagram";2020;JMIR Public Health and Surveillance;6;3;e20794;;;;17;10.2196/20794;https://www.scopus.com/inward/record.uri?eid=2-s2.0-85097873135&doi=10.2196%2f20794&partnerID=40&md5=0141eb70e5e1454dd4f293923f4293b7;Article;Final;"All Open Access; Gold; Green";Scopus;2-s2.0-85097873135
"Kan; W.-C.; Kuo; S.-C.; Chien; T.-W.; Lin; J.-C.J.; Yeh; Y.-T.; Chou; W.; Chou; P.-H.";"24071192400;55648942600;24075181800;57217002867;57216701354;21742282900;16300862400;";"Therapeutic duplication in Taiwan hospitals for patients with high blood pressure; sugar; and lipids: Evaluation with a mobile health mapping tool";2020;JMIR Medical Informatics;8;7;e11627;;;;1;10.2196/11627;https://www.scopus.com/inward/record.uri?eid=2-s2.0-85097470455&doi=10.2196%2f11627&partnerID=40&md5=51954ebd30572a05e2e9cde60b15ae7f;Article;Final;"All Open Access; Gold";Scopus;2-s2.0-85097470455
"Badii; C.; Bilotta; S.; Cenni; D.; Difino; A.; Nesi; P.; Paoli; I.; Paolucci; M.";"57118053300;55225891700;24476517500;6507876574;7003901227;57201282093;24778312700;";Real-Time Automatic Air Pollution Services from IOT Data Network;2020;Proceedings - IEEE Symposium on Computers and Communications;2020-July;;9219580;;;;1;10.1109/ISCC50000.2020.9219580;https://www.scopus.com/inward/record.uri?eid=2-s2.0-85092704223&doi=10.1109%2fISCC50000.2020.9219580&partnerID=40&md5=420356091a31750056fd8af9101c6b79;Conference Paper;Final;;Scopus;2-s2.0-85092704223
"Devarajan; A.A.; Sudalaimuthu; T.; Sankaran; K.S.";"57211332483;36919367400;56441081200;";Enhanced Storage Management Optimization in IaaS Cloud Environment;2020;"Proceedings of the 2020 IEEE International Conference on Communication and Signal Processing; ICCSP 2020";;;9182114;1589;1594;;;10.1109/ICCSP48568.2020.9182114;https://www.scopus.com/inward/record.uri?eid=2-s2.0-85091329092&doi=10.1109%2fICCSP48568.2020.9182114&partnerID=40&md5=12502f27e22e70a28c9aa6a44624f921;Conference Paper;Final;;Scopus;2-s2.0-85091329092
"De Laet; T.; Millecamp; M.; Ortiz-Rojas; M.; Jimenez; A.; Maya; R.; Verbert; K.";"15761675700;57201726346;57188760691;57205866252;56709531200;13605498800;";Adoption and impact of a learning analytics dashboard supporting the advisor—Student dialogue in a higher education institute in Latin America;2020;British Journal of Educational Technology;51;4;;1002;1018;;7;10.1111/bjet.12962;https://www.scopus.com/inward/record.uri?eid=2-s2.0-85085922483&doi=10.1111%2fbjet.12962&partnerID=40&md5=93698c444346155e00846680f73b7f4a;Article;Final;"All Open Access; Green";Scopus;2-s2.0-85085922483
"Guerra; J.; Ortiz-Rojas; M.; Zúñiga-Prieto; M.A.; Scheihing; E.; Jiménez; A.; Broos; T.; De Laet; T.; Verbert; K.";"55440492800;57188760691;56524481200;6507514502;57205866252;57195062927;15761675700;13605498800;";Adaptation and evaluation of a learning analytics dashboard to improve academic support at three Latin American universities;2020;British Journal of Educational Technology;51;4;;973;1001;;6;10.1111/bjet.12950;https://www.scopus.com/inward/record.uri?eid=2-s2.0-85085748337&doi=10.1111%2fbjet.12950&partnerID=40&md5=eddd01aa8aa7617660b3a25d28babf1b;Article;Final;"All Open Access; Green";Scopus;2-s2.0-85085748337
"Tschinkel; G.";"56369639700;";A recommendation dashboard utilising micro-filter visualisations: An evaluation and investigation of applicability on mobile devices;2020;Graphical Models;110;;101074;;;;;10.1016/j.gmod.2020.101074;https://www.scopus.com/inward/record.uri?eid=2-s2.0-85085573645&doi=10.1016%2fj.gmod.2020.101074&partnerID=40&md5=7d82e518f0b7e7e6433c1918e67d0981;Article;Final;;Scopus;2-s2.0-85085573645
"Matheus; R.; Janssen; M.; Maheshwari; D.";"6701611573;16199813000;54884044400;";Data science empowering the public: Data-driven dashboards for transparent and accountable decision-making in smart cities;2020;Government Information Quarterly;37;3;101284;;;;54;10.1016/j.giq.2018.01.006;https://www.scopus.com/inward/record.uri?eid=2-s2.0-85044786511&doi=10.1016%2fj.giq.2018.01.006&partnerID=40&md5=69ea19c075506610ccfd9e35f11a12f8;Article;Final;"All Open Access; Hybrid Gold; Green";Scopus;2-s2.0-85044786511
"Verhagen; M.D.; Brazel; D.M.; Dowd; J.B.; Kashnitsky; I.; Kashnitsky; I.; Mills; M.C.";"57217424794;57205351442;14035653400;56005450800;56005450800;14066587100;";"Forecasting spatial; socioeconomic and demographic variation in COVID-19 health care demand in England and Wales";2020;BMC Medicine;18;1;203;;;;18;10.1186/s12916-020-01646-2;https://www.scopus.com/inward/record.uri?eid=2-s2.0-85087214692&doi=10.1186%2fs12916-020-01646-2&partnerID=40&md5=e04d0f6c010e6918836496358bfbfe1c;Article;Final;"All Open Access; Gold; Green";Scopus;2-s2.0-85087214692
"Orr; M.K.; Martin; B.A.; Spilka; R.B.; Brotherton; H.B.; Ehlert; K.M.";"23095283500;57214463767;57219850282;57219855832;57192557456;";Development of an academic dashboard for empowering students to be adaptive decision-makers;2020;"ASEE Annual Conference and Exposition; Conference Proceedings";2020-June;;498;;;;;;https://www.scopus.com/inward/record.uri?eid=2-s2.0-85095744386&partnerID=40&md5=a0afa200277bef258ebaf06e3e07383d;Conference Paper;Final;;Scopus;2-s2.0-85095744386
"Knoop-Van Campen; C.; Molenaar; I.";"57193771349;24577798700;";How teachers integrate dashboards into their feedback practices;2020;Frontline Learning Research;8;4;;37;51;;3;10.14786/flr.v8i4.641;https://www.scopus.com/inward/record.uri?eid=2-s2.0-85095417845&doi=10.14786%2fflr.v8i4.641&partnerID=40&md5=6cd38541f76d3563a06c5163d3ba4857;Article;Final;"All Open Access; Bronze; Green";Scopus;2-s2.0-85095417845
"Fireteanu; V.-V.";"57210992831;";Integrating Tableau with Internet of Things Acquiring Projects;2020;"Proceedings of the 12th International Conference on Electronics; Computers and Artificial Intelligence; ECAI 2020";;;9223228;;;;;10.1109/ECAI50035.2020.9223228;https://www.scopus.com/inward/record.uri?eid=2-s2.0-85095742490&doi=10.1109%2fECAI50035.2020.9223228&partnerID=40&md5=a8acb2ec9483b60434895d89a9f8f946;Conference Paper;Final;;Scopus;2-s2.0-85095742490
"Vazquez-Ingelmo; A.; Garcia-Holgado; A.; Garcia-Penalvo; F.J.; Theron; R.";"57195074625;55754418500;16031087300;6602575901;";A meta-model to develop learning ecosystems with support for knowledge discovery and decision-making processes;2020;"Iberian Conference on Information Systems and Technologies; CISTI";2020-June;;9140986;;;;;10.23919/CISTI49556.2020.9140986;https://www.scopus.com/inward/record.uri?eid=2-s2.0-85089023677&doi=10.23919%2fCISTI49556.2020.9140986&partnerID=40&md5=339a675cf6b0398af7cd917fc73dfff1;Conference Paper;Final;;Scopus;2-s2.0-85089023677
"Laureano; R.M.S.; Laureano; L.M.S.; Sanz; A.C.P.";"37017381200;55459354000;57218385741;";Dashboard to monitor outages in a smart grid [Dashboard para monitorizar falhas de energia numa rede eletrica inteligente];2020;"Iberian Conference on Information Systems and Technologies; CISTI";2020-June;;9140869;;;;;10.23919/CISTI49556.2020.9140869;https://www.scopus.com/inward/record.uri?eid=2-s2.0-85089016580&doi=10.23919%2fCISTI49556.2020.9140869&partnerID=40&md5=5bdf26bb91dfb1174ec1f9f344912c80;Conference Paper;Final;"All Open Access; Green";Scopus;2-s2.0-85089016580
"Moore; J.B.; Dilley; J.R.; Singletary; C.R.; Skelton; J.A.; Miller; D.P.; Heboyan; V.; de Leo; G.; Turner-McGrievy; G.; McGrievy; M.; Ip; E.H.";"35366936400;57210884814;57194511678;7005629464;57212803340;6507050919;55949092000;7801439333;57195264085;36917734200;";A clinical trial to increase self-monitoring of physical activity and eating behaviors among adolescents: Protocol for the impact feasibility study;2020;JMIR Research Protocols;9;6;e18098;;;;1;10.2196/18098;https://www.scopus.com/inward/record.uri?eid=2-s2.0-85088960453&doi=10.2196%2f18098&partnerID=40&md5=b4f265379b71ad27cee70a6c6881aae4;Article;Final;"All Open Access; Gold; Green";Scopus;2-s2.0-85088960453
"Piri; Z.; Samad-Soltani; T.; Elahi; S.M.H.; Khezri; H.";"54412972800;57195059375;57217164453;57205729484;";Information visualization to support the decision-making process in the context of academic management;2020;Webology;17;1;218;;;;3;10.14704/WEB/V17I1/A218;https://www.scopus.com/inward/record.uri?eid=2-s2.0-85086566269&doi=10.14704%2fWEB%2fV17I1%2fA218&partnerID=40&md5=c36bc0811cce218ceca395657cff106f;Article;Final;"All Open Access; Gold";Scopus;2-s2.0-85086566269
"Bae; Y.S.; Kim; K.H.; Choi; S.W.; Ko; T.; Wook; C.; Cho; B.; Kim; M.S.; Kang; E.";"57191583961;56380795800;56124321400;57210802025;8879131000;24401032400;55568531722;57201013209;";Information Technology-based management of clinically healthy COVID-19 Patients: Lessons from a living and treatment support center operated by seoul national university hospital;2020;Journal of Medical Internet Research;22;6;e19938;;;;14;10.2196/19938;https://www.scopus.com/inward/record.uri?eid=2-s2.0-85086523141&doi=10.2196%2f19938&partnerID=40&md5=212c4277f5c581f1cf028a5a3524411a;Article;Final;"All Open Access; Gold; Green";Scopus;2-s2.0-85086523141
"Reinking; J.; Arnold; V.; Sutton; S.G.";"55250957700;7007169342;7202739909;";Synthesizing enterprise data through digital dashboards to strategically align performance: Why do operational managers use dashboards?;2020;International Journal of Accounting Information Systems;37;;100452;;;;7;10.1016/j.accinf.2020.100452;https://www.scopus.com/inward/record.uri?eid=2-s2.0-85083011108&doi=10.1016%2fj.accinf.2020.100452&partnerID=40&md5=5443b9034dac2a6ad92a09959bfe5a91;Article;Final;;Scopus;2-s2.0-85083011108
"Ahern; S.; Feiler; R.; Sdrinis; S.";"55601207100;57215573775;57215584220;";Maximising the value of clinical registry information through integration with a health service clinical governance framework: A case study;2020;Australian Health Review;44;3;;421;426;;1;10.1071/AH19004;https://www.scopus.com/inward/record.uri?eid=2-s2.0-85081251397&doi=10.1071%2fAH19004&partnerID=40&md5=8da178553e757abb0792c9fa8086284c;Article;Final;"All Open Access; Hybrid Gold";Scopus;2-s2.0-85081251397
"Mentzakis; E.; Tkacz; D.; Rivas; C.";"24765408300;56857574700;57203078633;";A proof-of-concept framework for the preference elicitation and evaluation of health informatics technologies: The online PRESENT patient experience dashboard as a case example;2020;BMC Medical Informatics and Decision Making;20;1;95;;;;;10.1186/s12911-020-1098-z;https://www.scopus.com/inward/record.uri?eid=2-s2.0-85085357339&doi=10.1186%2fs12911-020-1098-z&partnerID=40&md5=9d5ab7887a3acf76bbe998eabb002305;Article;Final;"All Open Access; Gold; Green";Scopus;2-s2.0-85085357339
"Beheshti; E.; Lyons; L.; Mallavarapu; A.; Wallingford; B.; Uzzo; S.";"24729198500;22835475800;57209399189;57218770691;26323912700;";Design considerations for data-driven dashboards: Supporting facilitation tasks for open-ended learning;2020;Conference on Human Factors in Computing Systems - Proceedings;;;3382871;;;;1;10.1145/3334480.3382871;https://www.scopus.com/inward/record.uri?eid=2-s2.0-85090229624&doi=10.1145%2f3334480.3382871&partnerID=40&md5=db7c39b2c84dc23e0eb66ea7240ce4cc;Conference Paper;Final;;Scopus;2-s2.0-85090229624
"Fischer; M.J.; Kourany; W.M.; Sovern; K.; Forrester; K.; Griffin; C.; Lightner; N.; Loftus; S.; Murphy; K.; Roth; G.; Palevsky; P.M.; Crowley; S.T.";"35508428800;14054094300;57216429523;57216428548;57193442546;6603403102;57216429436;57201445799;57216428997;57203055903;24461022700;";"Development; implementation and user experience of the Veterans Health Administration (VHA) dialysis dashboard";2020;BMC Nephrology;21;1;136;;;;2;10.1186/s12882-020-01798-6;https://www.scopus.com/inward/record.uri?eid=2-s2.0-85083477733&doi=10.1186%2fs12882-020-01798-6&partnerID=40&md5=9250283afbf943e1c5c0c684ccbc75e8;Article;Final;"All Open Access; Gold; Green";Scopus;2-s2.0-85083477733
"Telaga; A.S.; Rascalia; R.";"56104037400;57216636536;";Framework of low cost IOT system to monitor coal mining wastewater quality;2020;AIP Conference Proceedings;2217;;30148;;;;;10.1063/5.0000713;https://www.scopus.com/inward/record.uri?eid=2-s2.0-85084123381&doi=10.1063%2f5.0000713&partnerID=40&md5=aa6a1a940a848eb3e416cd07966d7abb;Conference Paper;Final;;Scopus;2-s2.0-85084123381
"Sharp; A.; Ojeda; D.; Nilsen; V.";"57221961385;57217314484;57217314125;";A New Dashboard Tool to Enhance Data Processing and Energy Efficiency Analysis in Modern Buildings;2020;"2020 Systems and Information Engineering Design Symposium; SIEDS 2020";;;9106664;;;;;10.1109/SIEDS49339.2020.9106664;https://www.scopus.com/inward/record.uri?eid=2-s2.0-85087047820&doi=10.1109%2fSIEDS49339.2020.9106664&partnerID=40&md5=9c051ff3053c30f5ca867b93323d7dbc;Conference Paper;Final;;Scopus;2-s2.0-85087047820
"Hodicky; J.; Özkan; G.; Özdemir; H.; Stodola; P.; Drozd; J.; Buck; W.";"57211278119;37059608900;57216780520;26435522100;57201254981;25940830900;";Dynamic modeling for resilience measurement: Nato resilience decision support model;2020;Applied Sciences (Switzerland);10;8;2639;;;;5;10.3390/APP10082639;https://www.scopus.com/inward/record.uri?eid=2-s2.0-85084664198&doi=10.3390%2fAPP10082639&partnerID=40&md5=b6a5d5c2867bde04752e69b45a4ff7fc;Article;Final;"All Open Access; Gold";Scopus;2-s2.0-85084664198
"Janssen; A.; Donnelly; C.; Kay; J.; Thiem; P.; Saavedra; A.; Pathmanathan; N.; Elder; E.; Dinh; P.; Kabir; M.; Jackson; K.; Harnett; P.; Shaw; T.";"56900648800;57210571947;7201938514;57216536402;56433794200;8638726400;56084409000;24576347600;57202667419;57216536565;7004031690;35234984900;";Developing an Intranet-Based Lymphedema Dashboard for Breast Cancer Multidisciplinary Teams: Design Research Study;2020;Journal of Medical Internet Research;22;4;e13188;;;;2;10.2196/13188;https://www.scopus.com/inward/record.uri?eid=2-s2.0-85083811706&doi=10.2196%2f13188&partnerID=40&md5=84a9a635b1b188076d50a5f73f618f5a;Article;Final;"All Open Access; Gold; Green";Scopus;2-s2.0-85083811706
"Vázquez-Ingelmo; A.; García-Peñalvo; F.J.; Therón; R.; Conde; M.A.";"57195074625;16031087300;6602575901;25929059400;";Representing data visualization goals and tasks through meta-modeling to tailor information dashboards;2020;Applied Sciences (Switzerland);10;7;2306;;;;8;10.3390/app10072306;https://www.scopus.com/inward/record.uri?eid=2-s2.0-85083550047&doi=10.3390%2fapp10072306&partnerID=40&md5=47afc1afd913244fc69aea1949d473f7;Article;Final;"All Open Access; Gold; Green";Scopus;2-s2.0-85083550047
"Offodile; A.C.; Sen; A.P.; Holtsmith; S.; Escalante; J.; Park; A.; Terrell; J.; Bassett; R.; Perrier; N.D.";"16203510300;56029406900;57215198246;57215208710;57211004013;56008853500;7005958706;7004729249;";Harnessing Behavioral Economics Principles to Promote Better Surgeon Accountability for Operating Room Cost: A Prospective Study;2020;Journal of the American College of Surgeons;230;4;;585;593;;3;10.1016/j.jamcollsurg.2019.12.013;https://www.scopus.com/inward/record.uri?eid=2-s2.0-85080089124&doi=10.1016%2fj.jamcollsurg.2019.12.013&partnerID=40&md5=8466c5be57f26157a5f278549f06e020;Conference Paper;Final;;Scopus;2-s2.0-85080089124
"Verbert; K.; Ochoa; X.; De Croon; R.; Dourado; R.A.; De Laet; T.";"13605498800;15050959300;56422480600;55587973200;15761675700;";"Learning analytics dashboards: The past; the present and the future";2020;PervasiveHealth: Pervasive Computing Technologies for Healthcare;;;;35;40;;15;10.1145/3375462.3375504;https://www.scopus.com/inward/record.uri?eid=2-s2.0-85082395570&doi=10.1145%2f3375462.3375504&partnerID=40&md5=b39ad0a7f92cb1fd9c54ace83adec328;Conference Paper;Final;"All Open Access; Green";Scopus;2-s2.0-85082395570
"Lewinski; M.; Bramkamp; Y.; Köster; T.; Staiger; D.";"56398071700;57215811786;36451034100;7005191329;";SEQing: Web-based visualization of iCLIP and RNA-seq data in an interactive python framework;2020;BMC Bioinformatics;21;1;113;;;;;10.1186/s12859-020-3434-9;https://www.scopus.com/inward/record.uri?eid=2-s2.0-85081978803&doi=10.1186%2fs12859-020-3434-9&partnerID=40&md5=fe811989c9875de4dc4514105854d664;Article;Final;"All Open Access; Gold; Green";Scopus;2-s2.0-85081978803
"Grange; E.S.; Neil; E.J.; Stoffel; M.; Singh; A.P.; Tseng; E.; Resco-Summers; K.; Fellner; B.J.; Lynch; J.B.; Mathias; P.C.; Mauritz-Miller; K.; Sutton; P.R.; Leu; M.G.";"57216343515;57216331991;57203025331;57212846383;57216346936;57216344821;57207313908;55199209200;34571069000;57216336191;57217459512;16425904400;";Responding to COVID-19: The UW Medicine Information Technology Services Experience;2020;Applied Clinical Informatics;11;2;;265;275;;72;10.1055/s-0040-1709715;https://www.scopus.com/inward/record.uri?eid=2-s2.0-85083193546&doi=10.1055%2fs-0040-1709715&partnerID=40&md5=a3448903455bd31623156029fb2caf64;Article;Final;"All Open Access; Hybrid Gold; Green";Scopus;2-s2.0-85083193546
"Oakey-Neate; L.; Schrader; G.; Strobel; J.; Bastiampillai; T.; Van Kasteren; Y.; Bidargaddi; N.";"57214868453;7006757862;36646771000;6508023555;56378615400;23388657300;";Using algorithms to initiate needs-based interventions for people on antipsychotic medication: Implementation protocol;2020;BMJ Health and Care Informatics;27;1;e100084;;;;1;10.1136/bmjhci-2019-100084;https://www.scopus.com/inward/record.uri?eid=2-s2.0-85079338544&doi=10.1136%2fbmjhci-2019-100084&partnerID=40&md5=7bc5e365c3760235daebfd6236d95e33;Article;Final;"All Open Access; Gold; Green";Scopus;2-s2.0-85079338544
"Hautte; S.V.; Moens; P.; Van Herwegen; J.; De Paepe; D.; Steenwinckel; B.; Verstichel; S.; Ongenae; F.; Van Hoecke; S.";"57204113922;57215091723;56728482300;57191664616;57203414733;16067553700;24829779200;8576234000;";A dynamic dashboarding application for fleet monitoring using semantic web of things technologies;2020;Sensors (Switzerland);20;4;1152;;;;6;10.3390/s20041152;https://www.scopus.com/inward/record.uri?eid=2-s2.0-85079895142&doi=10.3390%2fs20041152&partnerID=40&md5=5924f203cb76c9b754b86c4420d7ff9b;Article;Final;"All Open Access; Gold; Green";Scopus;2-s2.0-85079895142
"Ospina-Pinillos; L.; Davenport; T.A.; Navarro-Mancilla; A.A.; Cheng; V.W.S.; Alarcón; A.C.C.; Rangel; A.M.; Rueda-Jaimes; G.E.; Gomez-Restrepo; C.; Hickie; I.B.";"57004768400;7006686351;25958801800;57195488179;57212572909;55758708900;8259759100;55885880500;17734678500;";Involving end users in adapting a Spanish version of a web-based mental health clinic for young people in Colombia: Exploratory study using participatory design methodologies;2020;JMIR Mental Health;7;2;e15914;;;;6;10.2196/15914;https://www.scopus.com/inward/record.uri?eid=2-s2.0-85097854469&doi=10.2196%2f15914&partnerID=40&md5=d3e6b3fea5d3c2b7bba527d2069a1294;Article;Final;"All Open Access; Gold; Green";Scopus;2-s2.0-85097854469
"Sun; M.; Haihong; E.; Ou; Z.; Chen; Y.";"57216418134;36679915000;24822358000;57216417646;";More flexible: A free-customization technique based on log visualization;2020;"Proceedings - 2020 12th International Conference on Measuring Technology and Mechatronics Automation; ICMTMA 2020";;;9050230;375;381;;;10.1109/ICMTMA50254.2020.00089;https://www.scopus.com/inward/record.uri?eid=2-s2.0-85083425754&doi=10.1109%2fICMTMA50254.2020.00089&partnerID=40&md5=b18f39bfc94d97bf8eaebfbd24ff4dbb;Conference Paper;Final;;Scopus;2-s2.0-85083425754
"Picardal; C.; Pugliese; B.; Rhee; S.; Nguyen; C.; Kadiyala; R.; Thompson; K.";"6504698362;57214675726;7401852007;57199000156;36900839900;7402891837;";Bellevue Smart: Development and Integration of a Smart City;2020;Journal - American Water Works Association;112;2;;28;37;;2;10.1002/awwa.1446;https://www.scopus.com/inward/record.uri?eid=2-s2.0-85078903264&doi=10.1002%2fawwa.1446&partnerID=40&md5=1c95a669d3a0fbc3b0e94dc0a990d471;Note;Final;"All Open Access; Green";Scopus;2-s2.0-85078903264
"Yoo; S.; Lim; K.; Baek; H.; Jang; S.-K.; Hwang; G.-Y.; Kim; H.; Hwang; H.";"8426359900;57207764044;55759155100;57211096089;57212227589;36190828200;8632587500;";Developing a mobile epilepsy management application integrated with an electronic health record for effective seizure management;2020;International Journal of Medical Informatics;134;;104051;;;;9;10.1016/j.ijmedinf.2019.104051;https://www.scopus.com/inward/record.uri?eid=2-s2.0-85076256357&doi=10.1016%2fj.ijmedinf.2019.104051&partnerID=40&md5=16b0523699ef8bd362b1ce53e74054aa;Article;Final;;Scopus;2-s2.0-85076256357
"Burns; J.L.; Hasting; D.; Gichoya; J.W.; McKibben; B.; Shea; L.; Frank; M.";"57211413451;57211414108;55805424500;57211410875;57194770450;35548712700;";Just in Time Radiology Decision Support Using Real-time Data Feeds;2020;Journal of Digital Imaging;33;1;;137;142;;;10.1007/s10278-019-00268-2;https://www.scopus.com/inward/record.uri?eid=2-s2.0-85073813245&doi=10.1007%2fs10278-019-00268-2&partnerID=40&md5=c4c8c3c02cf5d2ab46015afc27a7d468;Article;Final;"All Open Access; Green";Scopus;2-s2.0-85073813245
"Bennett; L.; Folley; S.";"56184761100;56113586500;";Four design principles for learner dashboards that support student agency and empowerment;2020;Journal of Applied Research in Higher Education;12;1;;15;26;;5;10.1108/JARHE-11-2018-0251;https://www.scopus.com/inward/record.uri?eid=2-s2.0-85067005027&doi=10.1108%2fJARHE-11-2018-0251&partnerID=40&md5=fb0e1ea219d0e005fca01ba55cc2a76f;Article;Final;"All Open Access; Green";Scopus;2-s2.0-85067005027
